{
  "$schema": "../schemas/asset-benchmark-config.schema.json",
  "region": "ap-southeast-2",
  "concurrency": 4,
  "profiles": ["tiny-many"],
  "implementations": ["shin", "aws"],
  "lambdaConfigs": [
    {
      "memoryMb": 2048,
      "parallel": 64
    },
    {
      "memoryMb": 4096,
      "parallel": 128
    }
  ],
  "phases": [
    {
      "name": "cold-create",
      "state": "baseline",
      "wait": true
    },
    {
      "name": "forced-unchanged",
      "state": "baseline",
      "wait": false
    },
    {
      "name": "sparse-update",
      "state": "changed",
      "wait": true
    },
    {
      "name": "prune-update",
      "state": "pruned",
      "wait": true
    }
  ]
}
